<?xml version="1.0" encoding="UTF-8"?>
<st3:ContributionsCollection xmlns:xsi="http://www.w3.org/2001/XMLSchema-instance"
		xmlns:st3="http://nure.ua/shevchenko/Practice7/entity"
		xsi:schemaLocation="http://nure.ua/shevchenko/Practice7/entity input.xsd">			
		
	<Bank>	
		<Name>Test1</Name>
		<Country>Test</Country>
		<Type>Poste restante</Type>
		<Depositor>Test</Depositor>
		<AccountId>2</AccountId>
		<AmountOnDeposit>31.0</AmountOnDeposit>
		<Profitability>0.05</Profitability>
		<TimeConstraints>2001-10-26T21:32:52</TimeConstraints>
	</Bank>		
	
		<Bank>	
		<Name>Test3</Name>
		<Country>Test</Country>
		<Type>Urgent</Type>
		<Depositor>Test</Depositor>
		<AccountId>2</AccountId>
		<AmountOnDeposit>3.0</AmountOnDeposit>
		<Profitability>0.2</Profitability>
		<TimeConstraints>2001-10-26T21:32:52</TimeConstraints>
	</Bank>		
	
	<Bank>	
		<Name>Test2</Name>
		<Country>Test</Country>
		<Type>Checking account</Type>
		<Depositor>Test</Depositor>
		<AccountId>2</AccountId>
		<AmountOnDeposit>333.0</AmountOnDeposit>
		<Profitability>0.1</Profitability>
		<TimeConstraints>2001-10-26T21:32:52</TimeConstraints>
	</Bank>	
	
	<Bank>	
		<Name>Test4</Name>
		<Country>Test</Country>
		<Type>Savings</Type>
		<Depositor>Test</Depositor>
		<AccountId>2</AccountId>
		<AmountOnDeposit>3421.0</AmountOnDeposit>
		<Profitability>0.25</Profitability>
		<TimeConstraints>2001-10-26T21:32:52</TimeConstraints>
	</Bank>	
	
</st3:ContributionsCollection>